{
  "format_version": "1",
  "rules": {
    "azure/api-management": "azure/api-management",
    "azure/app-service-plan": "azure/app-service",
    "azure/application-insights": "azure/monitor",
    "azure/blob-container": "generic/storage",
    "azure/container-app": "azure/container-apps",
    "azure/container-app-environment": "azure/container-apps",
    "azure/cosmos-account": "azure/cosmos-db",
    "azure/cosmos-sql-container": "azure/cosmos-db",
    "azure/cosmos-sql-database": "azure/cosmos-db",
    "azure/event-grid-domain": "azure/event-grid",
    "azure/event-grid-domain-topic": "azure/event-grid",
    "azure/event-grid-event-subscription": "azure/event-grid",
    "azure/event-grid-system-topic": "azure/event-grid",
    "azure/event-grid-system-topic-subscription": "azure/event-grid",
    "azure/event-hub": "azure/event-hubs",
    "azure/event-hubs-consumer-group": "azure/event-hubs",
    "azure/event-hubs-namespace": "azure/event-hubs",
    "azure/key-vault": "azure/key-vault",
    "azure/key-vault-secret": "azure/key-vault",
    "azure/linux-function-app": "azure/functions",
    "azure/log-analytics-workspace": "azure/monitor",
    "azure/nat-gateway": "azure/nat-gateway",
    "azure/nat-gateway-public-ip-association": "generic/network",
    "azure/private-dns-zone": "azure/dns",
    "azure/private-dns-zone-vnet-link": "azure/dns",
    "azure/private-endpoint": "azure/private-link",
    "azure/public-address": "generic/network",
    "azure/queue-storage-queue": "generic/storage",
    "azure/resource-group": "azure/resource-group",
    "azure/service-bus-namespace": "azure/service-bus",
    "azure/service-bus-queue": "azure/service-bus",
    "azure/service-bus-subscription": "azure/service-bus",
    "azure/service-bus-topic": "azure/service-bus",
    "azure/storage-account": "azure/storage-account",
    "azure/subnet": "azure/subnet",
    "azure/subnet-nat-gateway-association": "generic/network",
    "azure/user-assigned-managed-identity": "azure/managed-identity",
    "azure/virtual-network": "azure/virtual-network"
  },
  "concepts": {
    "azure/app-service-plan": "generic/scope",
    "azure/application-insights": "generic/entity",
    "azure/container-app": "generic/entity",
    "azure/container-app-environment": "generic/scope",
    "azure/cosmos-account": "generic/scope",
    "azure/database-component": "generic/database",
    "azure/event-grid-domain": "generic/scope",
    "azure/event-grid-topic": "generic/scope",
    "azure/event-stream": "generic/entity",
    "azure/key-vault": "generic/scope",
    "azure/log-analytics-workspace": "generic/scope",
    "azure/messaging-detail": "generic/entity",
    "azure/messaging-namespace": "generic/scope",
    "azure/network-policy-detail": "generic/network",
    "azure/private-network-link": "generic/network",
    "azure/public-address": "generic/network",
    "azure/resource-group": "azure/resource-group",
    "azure/service-bus-topic": "generic/scope",
    "azure/storage-account": "generic/storage"
  },
  "rule_labels": {
    "azure/api-management": "API Management service",
    "azure/app-service-plan": "App Service plan",
    "azure/application-insights": "Application Insights",
    "azure/blob-container": "Blob Storage container",
    "azure/container-app": "Container App",
    "azure/container-app-environment": "Container Apps Environment",
    "azure/cosmos-account": "Cosmos DB account",
    "azure/cosmos-sql-container": "Cosmos DB for NoSQL container",
    "azure/cosmos-sql-database": "Cosmos DB for NoSQL database",
    "azure/event-grid-domain": "Event Grid domain",
    "azure/event-grid-domain-topic": "Event Grid domain topic",
    "azure/event-grid-event-subscription": "Event Grid subscription",
    "azure/event-grid-system-topic": "Event Grid system topic",
    "azure/event-grid-system-topic-subscription": "System topic subscription",
    "azure/event-hub": "Event Hubs event hub",
    "azure/event-hubs-consumer-group": "Event Hubs consumer group",
    "azure/event-hubs-namespace": "Event Hubs namespace",
    "azure/key-vault": "Key Vault",
    "azure/key-vault-secret": "Key Vault secret",
    "azure/linux-function-app": "Function App",
    "azure/log-analytics-workspace": "Log Analytics workspace",
    "azure/nat-gateway": "NAT Gateway",
    "azure/nat-gateway-public-ip-association": "NAT Gateway public IP association",
    "azure/private-dns-zone": "Private DNS zone",
    "azure/private-dns-zone-vnet-link": "Private DNS virtual network link",
    "azure/private-endpoint": "Private Endpoint",
    "azure/public-address": "Public IP address",
    "azure/queue-storage-queue": "Queue Storage queue",
    "azure/resource-group": "Resource Group",
    "azure/service-bus-namespace": "Service Bus namespace",
    "azure/service-bus-queue": "Service Bus queue",
    "azure/service-bus-subscription": "Service Bus subscription",
    "azure/service-bus-topic": "Service Bus topic",
    "azure/storage-account": "Storage account",
    "azure/subnet": "Subnet",
    "azure/subnet-nat-gateway-association": "Subnet NAT Gateway association",
    "azure/user-assigned-managed-identity": "User-assigned identity",
    "azure/virtual-network": "VNet"
  },
  "concept_labels": {}
}
