{
  "format_version": "1",
  "rules": {
    "azure/aks-cluster": "azure/aks",
    "azure/aks-node-pool": "generic/entity",
    "azure/app-service-plan": "azure/app-service",
    "azure/application-gateway": "azure/application-gateway",
    "azure/application-insights": "azure/monitor",
    "azure/azure-cache-for-redis": "azure/managed-redis",
    "azure/blob-container": "generic/storage",
    "azure/container-registry": "azure/container-registry",
    "azure/cosmos-account": "azure/cosmos-db",
    "azure/cosmos-sql-container": "azure/cosmos-db",
    "azure/cosmos-sql-database": "azure/cosmos-db",
    "azure/dns-a-record": "azure/dns",
    "azure/dns-cname-record": "azure/dns",
    "azure/dns-zone": "azure/dns",
    "azure/event-grid-system-topic": "azure/event-grid",
    "azure/event-grid-system-topic-subscription": "azure/event-grid",
    "azure/key-vault": "azure/key-vault",
    "azure/key-vault-key": "azure/key-vault",
    "azure/key-vault-secret": "azure/key-vault",
    "azure/linux-function-app": "azure/functions",
    "azure/log-analytics-solution": "azure/monitor",
    "azure/log-analytics-workspace": "azure/monitor",
    "azure/mssql-database": "azure/sql-database",
    "azure/mssql-server": "azure/sql-database",
    "azure/nat-gateway": "azure/nat-gateway",
    "azure/nat-gateway-public-ip-association": "generic/network",
    "azure/postgresql-flexible-server": "azure/postgresql",
    "azure/private-dns-zone": "azure/dns",
    "azure/private-dns-zone-vnet-link": "azure/dns",
    "azure/private-endpoint": "azure/private-link",
    "azure/public-address": "generic/network",
    "azure/resource-group": "azure/resource-group",
    "azure/service-bus-namespace": "azure/service-bus",
    "azure/service-bus-queue": "azure/service-bus",
    "azure/service-bus-subscription": "azure/service-bus",
    "azure/service-bus-topic": "azure/service-bus",
    "azure/storage-account": "azure/storage-account",
    "azure/subnet": "azure/subnet",
    "azure/subnet-nat-gateway-association": "generic/network",
    "azure/user-assigned-managed-identity": "azure/managed-identity",
    "azure/virtual-network": "azure/virtual-network",
    "azure/virtual-network-peering": "generic/network",
    "azure/web-application-firewall-policy": "azure/firewall",
    "kubernetes/kubernetes-daemon-set": "kubernetes/daemon-set",
    "kubernetes/kubernetes-deployment": "kubernetes/deployment",
    "kubernetes/kubernetes-ingress": "kubernetes/ingress",
    "kubernetes/kubernetes-namespace": "kubernetes/namespace",
    "kubernetes/kubernetes-network-policy": "kubernetes/network-policy",
    "kubernetes/kubernetes-service": "kubernetes/service",
    "kubernetes/kubernetes-service-account": "kubernetes/service-account",
    "kubernetes/kubernetes-stateful-set": "kubernetes/stateful-set"
  },
  "concepts": {
    "azure/app-service-plan": "generic/scope",
    "azure/application-insights": "generic/entity",
    "azure/container-registry": "generic/storage",
    "azure/cosmos-account": "generic/scope",
    "azure/database-component": "generic/database",
    "azure/dns-record": "generic/network",
    "azure/event-grid-topic": "generic/scope",
    "azure/key-vault": "generic/scope",
    "azure/log-analytics-workspace": "generic/scope",
    "azure/messaging-namespace": "generic/scope",
    "azure/network-policy-detail": "generic/network",
    "azure/operations-detail": "generic/entity",
    "azure/private-network-link": "generic/network",
    "azure/public-address": "generic/network",
    "azure/resource-group": "azure/resource-group",
    "azure/service-bus-topic": "generic/scope",
    "azure/sql-server": "generic/scope",
    "azure/storage-account": "generic/storage",
    "azure/web-application-firewall-policy": "azure/firewall",
    "kubernetes/daemon-set": "kubernetes/daemon-set",
    "kubernetes/deployment": "kubernetes/deployment",
    "kubernetes/ingress": "kubernetes/ingress",
    "kubernetes/namespace": "kubernetes/namespace",
    "kubernetes/network-policy": "kubernetes/network-policy",
    "kubernetes/service": "kubernetes/service",
    "kubernetes/service-account": "kubernetes/service-account",
    "kubernetes/stateful-set": "kubernetes/stateful-set"
  },
  "rule_labels": {
    "azure/aks-cluster": "AKS cluster",
    "azure/aks-node-pool": "AKS node pool",
    "azure/app-service-plan": "App Service plan",
    "azure/application-gateway": "Application Gateway",
    "azure/application-insights": "Application Insights",
    "azure/azure-cache-for-redis": "Azure Cache for Redis",
    "azure/blob-container": "Blob Storage container",
    "azure/container-registry": "Container Registry",
    "azure/cosmos-account": "Cosmos DB account",
    "azure/cosmos-sql-container": "Cosmos DB for NoSQL container",
    "azure/cosmos-sql-database": "Cosmos DB for NoSQL database",
    "azure/dns-a-record": "DNS A record",
    "azure/dns-cname-record": "DNS CNAME record",
    "azure/dns-zone": "DNS zone",
    "azure/event-grid-system-topic": "Event Grid system topic",
    "azure/event-grid-system-topic-subscription": "System topic subscription",
    "azure/key-vault": "Key Vault",
    "azure/key-vault-key": "Key Vault key",
    "azure/key-vault-secret": "Key Vault secret",
    "azure/linux-function-app": "Function App",
    "azure/log-analytics-solution": "Log Analytics solution",
    "azure/log-analytics-workspace": "Log Analytics workspace",
    "azure/mssql-database": "SQL Database",
    "azure/mssql-server": "SQL logical server",
    "azure/nat-gateway": "NAT Gateway",
    "azure/nat-gateway-public-ip-association": "NAT Gateway public IP association",
    "azure/postgresql-flexible-server": "PostgreSQL flexible server",
    "azure/private-dns-zone": "Private DNS zone",
    "azure/private-dns-zone-vnet-link": "Private DNS virtual network link",
    "azure/private-endpoint": "Private Endpoint",
    "azure/public-address": "Public IP address",
    "azure/resource-group": "Resource Group",
    "azure/service-bus-namespace": "Service Bus namespace",
    "azure/service-bus-queue": "Service Bus queue",
    "azure/service-bus-subscription": "Service Bus subscription",
    "azure/service-bus-topic": "Service Bus topic",
    "azure/storage-account": "Storage account",
    "azure/subnet": "Subnet",
    "azure/subnet-nat-gateway-association": "Subnet NAT Gateway association",
    "azure/user-assigned-managed-identity": "User-assigned identity",
    "azure/virtual-network": "VNet",
    "azure/virtual-network-peering": "Virtual Network peering",
    "azure/web-application-firewall-policy": "WAF policy"
  },
  "concept_labels": {}
}
